{
  "id": "P584FDFZGFEB8P08FNANNGSXR9",
  "run_id": "W5ZT1TXQV92JTWYQPS5WCF9YAN",
  "contexte": "run",
  "objet_note": {
    "type": "reponse",
    "id": "YPWCRSKQA9C9VVYJ9Z3SFNQX2F"
  },
  "notateur": {
    "type": "juge",
    "id": "juge-1",
    "famille_modele": "famille-x",
    "modele": "famille-x/modele-juge-1",
    "version_prompt": "prompts/judge-primaire-1.0.0",
    "a_vu_identite_outil": false
  },
  "version_charge": "charge-juge-v3",
  "gabarit": "Q-ATT",
  "references_item": [
    {
      "item_id": "YARYX9NM753C0AF6CDVVE6SVGM",
      "item_version": 1,
      "item_empreinte": "76ae5a1406b53af518d9c2dce5e7381bbb62d25df353a2a1b5614f00c87587d2"
    }
  ],
  "motif": "attribution_indecidable",
  "raison": "candidat cité au périmètre mais non interrogé, ou nom ambigu dont un candidat possible est attendu : aucun texte ne tranche.",
  "noms_cites": [
    "Prénom A",
    "Candidat Retiré"
  ],
  "attribution": {
    "attendus": [
      "candidat-a"
    ],
    "cites": [
      "candidat-a",
      "candidat-r"
    ]
  },
  "date": "2026-12-03T11:00:00+01:00"
}
